{
  "$schema": "https://json-schema.org/draft/2020-12/schema",
  "$id": "https://semiotic.ai/schemas/external_tool_metadata.schema.json",
  "title": "External Tool Metadata",
  "description": "Metadata contract for external tool packages. Shipped inside the tool OCI artifact as tool-metadata.json.",
  "type": "object",
  "required": [
    "tool_abi_version",
    "name",
    "description",
    "bundle",
    "local_name",
    "access_level",
    "invocation_mode",
    "schemas",
    "secrets",
    "capabilities"
  ],
  "properties": {
    "tool_abi_version": {
      "type": "string",
      "description": "Protocol ABI version this tool targets.",
      "enum": ["1"]
    },
    "name": {
      "type": "string",
      "description": "Fully qualified tool name (bundle/local_name).",
      "pattern": "^[a-z][a-z0-9_-]*/[a-z][a-z0-9_-]*$"
    },
    "description": {
      "type": "string",
      "description": "Human-readable description of the tool."
    },
    "bundle": {
      "type": "string",
      "description": "Bundle namespace (e.g. 'support').",
      "pattern": "^[a-z][a-z0-9_-]*$"
    },
    "local_name": {
      "type": "string",
      "description": "Tool name within its bundle (e.g. 'clickup').",
      "pattern": "^[a-z][a-z0-9_-]*$"
    },
    "access_level": {
      "type": "string",
      "description": "Default access level required to invoke this tool.",
      "enum": ["read", "write", "delete"]
    },
    "tags": {
      "type": "array",
      "items": { "type": "string" },
      "default": [],
      "description": "Tags for indexing/search."
    },
    "invocation_mode": {
      "type": "string",
      "description": "How the tool is invoked.",
      "enum": ["single_shot", "session"]
    },
    "session_policy": {
      "type": "string",
      "description": "Planner/session policy for repeated send/read behavior. Omitted defaults to strict.",
      "enum": ["strict", "multi_send"],
      "default": "strict"
    },
    "idempotency": {
      "type": "object",
      "description": "Idempotency declarations per operation.",
      "properties": {
        "default": {
          "type": "string",
          "enum": ["idempotent", "non_idempotent"]
        },
        "operations": {
          "type": "object",
          "additionalProperties": {
            "type": "string",
            "enum": ["idempotent", "non_idempotent"]
          }
        }
      }
    },
    "schemas": {
      "type": "object",
      "description": "Input/output JSON Schemas for the tool.",
      "required": ["input", "output"],
      "properties": {
        "input": {
          "type": "object",
          "description": "JSON Schema for tool input."
        },
        "output": {
          "type": "object",
          "description": "JSON Schema for tool output."
        }
      }
    },
    "secrets": {
      "type": "array",
      "items": { "type": "string" },
      "description": "Secret names required by this tool (resolved by runner)."
    },
    "secret_scope": {
      "type": "string",
      "description": "Where secrets are attached for session-mode tools.",
      "enum": ["send", "session"],
      "default": "send"
    },
    "capabilities": {
      "type": "object",
      "description": "Capability declarations for policy intersection.",
      "properties": {
        "http": {
          "type": ["object", "null"],
          "properties": {
            "hosts": {
              "type": "array",
              "items": { "type": "string" }
            }
          }
        },
        "grpc": {
          "type": ["object", "null"]
        },
        "tcp": {
          "type": ["object", "null"]
        },
        "fs": {
          "type": ["object", "null"]
        },
        "env": {
          "type": "array",
          "items": { "type": "string" },
          "default": []
        }
      }
    },
    "config_bundle": {
      "type": "string",
      "description": "Bundle key for config store lookup (optional)."
    },
    "resource_limits": {
      "type": "object",
      "description": "Resource limits for the tool process.",
      "properties": {
        "max_memory_mb": { "type": "integer", "minimum": 1 },
        "max_cpu_seconds": { "type": "integer", "minimum": 1 },
        "max_open_fds": { "type": "integer", "minimum": 1 },
        "max_concurrent_invocations": { "type": "integer", "minimum": 1, "default": 10 }
      }
    },
    "runtime": {
      "description": "Optional runtime declaration. Omitted defaults to process wrapper mode.",
      "oneOf": [
        {
          "type": "object",
          "required": ["kind"],
          "properties": {
            "kind": { "const": "process" },
            "command": {
              "type": "array",
              "items": { "type": "string" },
              "minItems": 1,
              "description": "argv command for process runtime"
            },
            "setup": {
              "type": "array",
              "items": { "type": "string" },
              "description": "optional deploy-time setup commands"
            }
          },
          "additionalProperties": false
        },
        {
          "type": "object",
          "required": ["kind", "image", "adapter"],
          "properties": {
            "kind": { "const": "sandbox" },
            "image": {
              "oneOf": [
                {
                  "type": "string",
                  "pattern": "^.+@sha256:[A-Fa-f0-9]{64}$",
                  "description": "legacy OCI image string form (deprecated)"
                },
                {
                  "type": "object",
                  "required": ["kind", "ref"],
                  "properties": {
                    "kind": { "const": "oci" },
                    "ref": {
                      "type": "string",
                      "pattern": "^.+@sha256:[A-Fa-f0-9]{64}$"
                    }
                  },
                  "additionalProperties": false
                },
                {
                  "type": "object",
                  "required": ["kind", "path"],
                  "properties": {
                    "kind": { "const": "bind" },
                    "path": { "type": "string", "pattern": "^(/|\\./|\\../).+" }
                  },
                  "additionalProperties": false
                }
              ]
            },
            "entrypoint": {
              "type": "array",
              "items": { "type": "string" },
              "description": "optional argv entrypoint for tool adapter"
            },
            "adapter": {
              "type": "object",
              "required": ["command", "protocol"],
              "properties": {
                "schema_version": { "type": "integer", "minimum": 1, "default": 1 },
                "protocol": {
                  "type": "string",
                  "enum": ["jsonrpc-stdio"]
                },
                "command": {
                  "type": "array",
                  "items": { "type": "string" },
                  "minItems": 1,
                  "description": "argv used by /tool-adapter to invoke tool child process"
                },
                "workdir": {
                  "type": "string",
                  "description": "Guest working directory used for sandbox creation, /tool-adapter launch cwd, and default PWD. Applies across sandbox image sources (bind, OCI, future disk backends). Must already exist inside the guest filesystem; if omitted, the runner falls back to '/'."
                }
              },
              "additionalProperties": false
            }
          },
          "additionalProperties": false
        }
      ]
    },
    "coordination": {
      "type": "object",
      "description": "Optional session-coordination BAML pointer. Required for session tools that expose a Choose<Tool>Action step-executor function; forbidden for single_shot tools.",
      "required": ["baml_file"],
      "properties": {
        "baml_file": {
          "type": "string",
          "description": "File name (relative to the tool directory) containing the coordination BAML fragment.",
          "minLength": 1
        }
      },
      "additionalProperties": false
    }
  },
  "additionalProperties": false
}
