{
  "tool_abi_version": "1",
  "name": "dev/claude-ext",
  "description": "Sandboxed Claude-style streaming session external tool",
  "bundle": "dev",
  "local_name": "claude-ext",
  "access_level": "write",
  "tags": [
    "dev",
    "claude-ext",
    "external",
    "session",
    "streaming"
  ],
  "invocation_mode": "session",
  "session_policy": "strict",
  "schemas": {
    "input": {
      "type": "object",
      "properties": {
        "prompt": {
          "type": "string"
        },
        "content": {
          "oneOf": [
            {
              "type": "array",
              "items": {
                "oneOf": [
                  {
                    "type": "object",
                    "properties": {
                      "kind": {
                        "type": "string",
                        "const": "text"
                      },
                      "text": {
                        "type": "string"
                      }
                    },
                    "required": [
                      "kind",
                      "text"
                    ],
                    "additionalProperties": false
                  },
                  {
                    "type": "object",
                    "properties": {
                      "kind": {
                        "type": "string",
                        "const": "image_url"
                      },
                      "url": {
                        "type": "string"
                      }
                    },
                    "required": [
                      "kind",
                      "url"
                    ],
                    "additionalProperties": false
                  },
                  {
                    "type": "object",
                    "properties": {
                      "kind": {
                        "type": "string",
                        "const": "image_base64"
                      },
                      "media_type": {
                        "type": "string"
                      },
                      "data": {
                        "type": "string"
                      }
                    },
                    "required": [
                      "kind",
                      "media_type",
                      "data"
                    ],
                    "additionalProperties": false
                  }
                ]
              }
            },
            {
              "oneOf": [
                {
                  "type": "object",
                  "properties": {
                    "kind": {
                      "type": "string",
                      "const": "text"
                    },
                    "text": {
                      "type": "string"
                    }
                  },
                  "required": [
                    "kind",
                    "text"
                  ],
                  "additionalProperties": false
                },
                {
                  "type": "object",
                  "properties": {
                    "kind": {
                      "type": "string",
                      "const": "image_url"
                    },
                    "url": {
                      "type": "string"
                    }
                  },
                  "required": [
                    "kind",
                    "url"
                  ],
                  "additionalProperties": false
                },
                {
                  "type": "object",
                  "properties": {
                    "kind": {
                      "type": "string",
                      "const": "image_base64"
                    },
                    "media_type": {
                      "type": "string"
                    },
                    "data": {
                      "type": "string"
                    }
                  },
                  "required": [
                    "kind",
                    "media_type",
                    "data"
                  ],
                  "additionalProperties": false
                }
              ]
            }
          ]
        },
        "userInput": {
          "type": "object",
          "properties": {
            "display_text": {
              "type": "string"
            },
            "prompt": {
              "type": "string"
            }
          },
          "additionalProperties": false
        }
      },
      "additionalProperties": false
    },
    "output": {
      "type": "object",
      "properties": {
        "events": {
          "type": "array",
          "items": {
            "oneOf": [
              {
                "type": "object",
                "properties": {
                  "kind": {
                    "type": "string",
                    "const": "assistant_text"
                  },
                  "text": {
                    "type": "string"
                  }
                },
                "required": [
                  "kind",
                  "text"
                ],
                "additionalProperties": false
              },
              {
                "type": "object",
                "properties": {
                  "kind": {
                    "type": "string",
                    "const": "assistant_thinking"
                  },
                  "thinking": {
                    "type": "string"
                  }
                },
                "required": [
                  "kind",
                  "thinking"
                ],
                "additionalProperties": false
              },
              {
                "type": "object",
                "properties": {
                  "kind": {
                    "type": "string",
                    "const": "system_notice"
                  },
                  "subtype": {
                    "type": "string"
                  },
                  "cwd": {
                    "type": "string"
                  },
                  "model": {
                    "type": "string"
                  },
                  "data": {
                    "type": "string"
                  }
                },
                "required": [
                  "kind",
                  "subtype",
                  "cwd",
                  "model"
                ],
                "additionalProperties": false
              },
              {
                "type": "object",
                "properties": {
                  "kind": {
                    "type": "string",
                    "const": "terminal_result"
                  },
                  "subtype": {
                    "type": "string"
                  },
                  "is_error": {
                    "type": "boolean"
                  },
                  "num_turns": {
                    "type": "integer"
                  },
                  "total_cost_usd": {
                    "type": "number"
                  },
                  "result": {
                    "type": "string"
                  }
                },
                "required": [
                  "kind",
                  "subtype",
                  "is_error",
                  "num_turns"
                ],
                "additionalProperties": false
              }
            ]
          }
        },
        "completion": {
          "type": "string",
          "enum": [
            "DONE",
            "INPUT_REQUIRED",
            "INTERRUPTED"
          ]
        },
        "historyContext": {
          "type": "object",
          "properties": {
            "hop": {
              "type": "integer"
            },
            "op": {
              "type": "string"
            },
            "status": {
              "type": "string"
            },
            "truncated": {
              "type": "boolean"
            },
            "cursor": {
              "type": [
                "string",
                "null"
              ]
            },
            "payload": {
              "type": "object",
              "properties": {
                "eventCount": {
                  "type": "integer"
                },
                "completion": {
                  "type": [
                    "string",
                    "null"
                  ]
                }
              },
              "additionalProperties": false
            }
          },
          "required": [
            "hop",
            "op",
            "status",
            "truncated"
          ],
          "additionalProperties": false
        }
      },
      "additionalProperties": false
    }
  },
  "secrets": [
    "ANTHROPIC_API_KEY",
    "CLAUDE_CODE_OAUTH_TOKEN",
    "CLAUDE_EXT_USE_SHELL_PIPELINE"
  ],
  "secret_scope": "send",
  "capabilities": {
    "http": {
      "hosts": [
        "api.anthropic.com",
        "statsig.anthropic.com",
        "registry.npmjs.org"
      ]
    }
  },
  "coordination": {
    "baml_file": "coordination.baml"
  },
  "runtime": {
    "kind": "sandbox",
    "image": {
      "kind": "bind",
      "path": "./.tmp/dev-claude-ext-rootfs"
    },
    "adapter": {
      "schema_version": 1,
      "protocol": "jsonrpc-stdio",
      "command": [
        "/tool-adapter"
      ],
      "workdir": "/"
    }
  }
}
