{
  "tool_abi_version": "1",
  "name": "dev/echo",
  "description": "Dev-mode echo tool. Returns the input message verbatim so you can smoke-test the external tools protocol without any business logic.",
  "bundle": "dev",
  "local_name": "echo",
  "access_level": "read",
  "tags": ["dev", "echo", "example"],
  "invocation_mode": "single_shot",
  "session_policy": "strict",
  "schemas": {
    "input": {
      "type": "object",
      "properties": {
        "message": {
          "type": "string",
          "description": "Arbitrary string to be echoed back."
        }
      },
      "required": ["message"],
      "additionalProperties": false
    },
    "output": {
      "type": "object",
      "properties": {
        "echoed": {
          "type": "string",
          "description": "The exact message received on input."
        }
      },
      "required": ["echoed"],
      "additionalProperties": false
    }
  },
  "secrets": [],
  "capabilities": {}
}
